{
  "$schema": "https://json-schema.org/draft/2020-12/schema",
  "$id": "https://agentlens.dev/schemas/agentlens.run.v2.json",
  "$comment": "Waygent trust console run header.",
  "title": "agentlens.run.v2",
  "type": "object",
  "additionalProperties": false,
  "required": ["schema", "run_id", "workspace_id", "started_at", "agent", "workspace", "recording", "trust_contract"],
  "properties": {
    "schema": {"type": "string", "const": "agentlens.run.v2"},
    "run_id": {"type": "string", "minLength": 1},
    "workspace_id": {"type": "string", "minLength": 1},
    "parent_run_id": {"type": ["string", "null"]},
    "started_at": {"type": "string", "pattern": "^\\d{4}-\\d{2}-\\d{2}T\\d{2}:\\d{2}:\\d{2}(\\.\\d+)?Z$"},
    "agent": {
      "type": "object",
      "additionalProperties": false,
      "required": ["name", "mode"],
      "properties": {
        "name": {"type": "string", "const": "waygent"},
        "mode": {"type": "string", "enum": ["runner"]},
        "version": {"type": "string"}
      }
    },
    "workspace": {
      "type": "object",
      "additionalProperties": false,
      "required": ["root_label", "root_hash", "id_basis"],
      "properties": {
        "root_label": {"type": "string"},
        "root_hash": {"type": "string", "pattern": "^sha256:[a-f0-9]{64}$"},
        "id_basis": {"type": "string", "enum": ["git", "path"]},
        "git_remote_hash": {"type": "string", "pattern": "^sha256:[a-f0-9]{64}$"},
        "git_branch": {"type": "string"},
        "commit_before": {"type": "string"}
      }
    },
    "recording": {
      "type": "object",
      "additionalProperties": false,
      "required": ["mode", "adapter"],
      "properties": {
        "mode": {"type": "string", "enum": ["minimal", "full"]},
        "adapter": {"type": "string", "const": "waygent"}
      }
    },
    "trust_contract": {
      "type": "object",
      "additionalProperties": false,
      "required": ["source", "waygent_run_id", "legacy_namespaces_supported"],
      "properties": {
        "source": {"type": "string", "const": "waygent"},
        "waygent_run_id": {"type": "string"},
        "legacy_namespaces_supported": {"type": "boolean", "const": false}
      }
    },
    "meta": {"type": "object"}
  }
}
