{
  "schema": "agentlens.run.v2",
  "run_id": "run_20260521_000000_agent",
  "workspace_id": "ws_0123456789abcdef",
  "started_at": "2026-05-21T00:00:00Z",
  "agent": {
    "name": "waygent",
    "mode": "runner",
    "version": "0.1.0"
  },
  "workspace": {
    "root_label": "<workspace>",
    "root_hash": "sha256:0123456789abcdef0123456789abcdef0123456789abcdef0123456789abcdef",
    "id_basis": "git"
  },
  "recording": {
    "mode": "minimal",
    "adapter": "waygent"
  },
  "trust_contract": {
    "source": "waygent",
    "waygent_run_id": "run_waygent",
    "legacy_namespaces_supported": false
  }
}
